index,tweet_id,timestamp,text,expanded_urls,dog_stage,jpg_url,img_num,p1,p1_conf,p1_dog,p2,p2_conf,p2_dog,p3,p3_conf,p3_dog,like_count,quote_count,reply_count,retweet_count,name,rating
1,892177421306343426,2017-08-01 00:17:27,"This is Tilly. She's just checking pup on you. Hopes you're doing ok. If not, she's available for pats, snugs, boops, the whole bit. 13/10 https://t.co/0Xxu71qeIV",https://twitter.com/dog_rates/status/892177421306343426/photo/1,,https://pbs.twimg.com/media/DGGmoV4XsAAUL6n.jpg,1,Chihuahua,0.323581,True,Pekinese,0.0906465,True,papillon,0.0689569,True,29360,274,170,5304,Tilly,1.3
2,891815181378084864,2017-07-31 00:18:03,This is Archie. He is a rare Norwegian Pouncing Corgo. Lives in the tall grass. You never know when one may strike. 12/10 https://t.co/wUnZnhtVJB,https://twitter.com/dog_rates/status/891815181378084864/photo/1,,https://pbs.twimg.com/media/DGBdLU1WsAANxJ9.jpg,1,Chihuahua,0.716012,True,malamute,0.078253,True,kelpie,0.0313789,True,22077,145,109,3487,Archie,1.2
3,891689557279858688,2017-07-30 15:58:51,This is Darla. She commenced a snooze mid meal. 13/10 happens to the best of us https://t.co/tD36da7qLQ,https://twitter.com/dog_rates/status/891689557279858688/photo/1,,https://pbs.twimg.com/media/DF_q7IAWsAEuuN8.jpg,1,paper_towel,0.17027799999999998,False,Labrador_retriever,0.168086,True,spatula,0.0408359,False,36971,286,142,7234,Darla,1.3
4,891327558926688256,2017-07-29 16:00:24,"This is Franklin. He would like you to stop calling him ""cute."" He is a very fierce shark and should be respected as such. 12/10 #BarkWeek https://t.co/AtUZn91f7f","https://twitter.com/dog_rates/status/891327558926688256/photo/1,https://twitter.com/dog_rates/status/891327558926688256/photo/1",,https://pbs.twimg.com/media/DF6hr6BUMAAzZgT.jpg,2,basset,0.555712,True,English_springer,0.22577,True,German_short-haired_pointer,0.175219,True,35348,296,193,7773,Franklin,1.2
5,891087950875897856,2017-07-29 00:08:17,Here we have a majestic great white breaching off South Africa's coast. Absolutely h*ckin breathtaking. 13/10 (IG: tucker_marlo) #BarkWeek https://t.co/kQ04fDDRmh,https://twitter.com/dog_rates/status/891087950875897856/photo/1,,https://pbs.twimg.com/media/DF3HwyEWsAABqE6.jpg,1,Chesapeake_Bay_retriever,0.425595,True,Irish_terrier,0.116317,True,Indian_elephant,0.07690219999999999,False,17828,43,58,2603,tucker,1.3
6,890971913173991426,2017-07-28 16:27:12,"Meet Jax. He enjoys ice cream so much he gets nervous around it. 13/10 help Jax enjoy more things by clicking below

https://t.co/Zr4hWfAs1H https://t.co/tVJBRMnhxl","https://gofundme.com/ydvmve-surgery-for-jax,https://twitter.com/dog_rates/status/890971913173991426/photo/1",,https://pbs.twimg.com/media/DF1eOmZXUAALUcq.jpg,1,Appenzeller,0.34170300000000003,True,Border_collie,0.199287,True,ice_lolly,0.193548,False,10380,55,51,1671,Jax,1.3
7,890729181411237888,2017-07-28 00:22:40,When you watch your owner call another dog a good boy but then they turn back to you and say you're a great boy. 13/10 https://t.co/v0nONBcwxq,"https://twitter.com/dog_rates/status/890729181411237888/photo/1,https://twitter.com/dog_rates/status/890729181411237888/photo/1",,https://pbs.twimg.com/media/DFyBahAVwAAhUTd.jpg,2,Pomeranian,0.566142,True,Eskimo_dog,0.17840599999999998,True,Pembroke,0.0765069,True,56907,377,159,15776,nan,1.3
8,890609185150312448,2017-07-27 16:25:51,This is Zoey. She doesn't want to be one of the scary sharks. Just wants to be a snuggly pettable boatpet. 13/10 #BarkWeek https://t.co/9TwLuAGH0b,https://twitter.com/dog_rates/status/890609185150312448/photo/1,,https://pbs.twimg.com/media/DFwUU__XcAEpyXI.jpg,1,Irish_terrier,0.487574,True,Irish_setter,0.193054,True,Chesapeake_Bay_retriever,0.118184,True,24555,129,92,3628,Zoey,1.3
9,890240255349198849,2017-07-26 15:59:51,This is Cassie. She is a college pup. Studying international doggo communication and stick theory. 14/10 so elegant much sophisticate https://t.co/t1bfwz5S2A,https://twitter.com/dog_rates/status/890240255349198849/photo/1,doggo,https://pbs.twimg.com/media/DFrEyVuW0AAO3t9.jpg,1,Pembroke,0.511319,True,Cardigan,0.451038,True,Chihuahua,0.0292482,True,27990,352,142,6108,Cassie,1.4
10,890006608113172480,2017-07-26 00:31:25,This is Koda. He is a South Australian deckshark. Deceptively deadly. Frighteningly majestic. 13/10 would risk a petting #BarkWeek https://t.co/dVPW0B0Mme,"https://twitter.com/dog_rates/status/890006608113172480/photo/1,https://twitter.com/dog_rates/status/890006608113172480/photo/1",,https://pbs.twimg.com/media/DFnwSY4WAAAMliS.jpg,1,Samoyed,0.957979,True,Pomeranian,0.0138835,True,chow,0.00816748,True,27067,267,154,6157,Koda,1.3
11,889880896479866881,2017-07-25 16:11:53,This is Bruno. He is a service shark. Only gets out of the water to assist you. 13/10 terrifyingly good boy https://t.co/u1XPQMl29g,https://twitter.com/dog_rates/status/889880896479866881/photo/1,,https://pbs.twimg.com/media/DFl99B1WsAITKsg.jpg,1,French_bulldog,0.377417,True,Labrador_retriever,0.151317,True,muzzle,0.0829811,False,24595,146,90,4174,Bruno,1.3
12,889665388333682689,2017-07-25 01:55:32,Here's a puppo that seems to be on the fence about something haha no but seriously someone help her. 13/10 https://t.co/BxvuXk0UCm,https://twitter.com/dog_rates/status/889665388333682689/photo/1,puppo,https://pbs.twimg.com/media/DFi579UWsAAatzw.jpg,1,Pembroke,0.966327,True,Cardigan,0.0273557,True,basenji,0.00463323,True,42095,318,174,8360,nan,1.3
13,889638837579907072,2017-07-25 00:10:02,This is Ted. He does his best. Sometimes that's not enough. But it's ok. 12/10 would assist https://t.co/f8dEDcrKSR,"https://twitter.com/dog_rates/status/889638837579907072/photo/1,https://twitter.com/dog_rates/status/889638837579907072/photo/1",,https://pbs.twimg.com/media/DFihzFfXsAYGDPR.jpg,1,French_bulldog,0.99165,True,boxer,0.00212864,True,Staffordshire_bullterrier,0.00149818,True,23709,199,92,3720,Ted,1.2
14,889531135344209921,2017-07-24 17:02:04,This is Stuart. He's sporting his favorite fanny pack. Secretly filled with bones only. 13/10 puppared puppo #BarkWeek https://t.co/y70o6h3isq,https://twitter.com/dog_rates/status/889531135344209921/photo/1,puppo,https://pbs.twimg.com/media/DFg_2PVW0AEHN3p.jpg,1,golden_retriever,0.953442,True,Labrador_retriever,0.0138341,True,redbone,0.00795775,True,13358,81,58,1885,Stuart,1.3
15,889278841981685760,2017-07-24 00:19:32,This is Oliver. You're witnessing one of his many brutal attacks. Seems to be playing with his victim. 13/10 fr*ckin frightening #BarkWeek https://t.co/WpHvrQedPb,https://twitter.com/dog_rates/status/889278841981685760/video/1,,https://pbs.twimg.com/ext_tw_video_thumb/889278779352338437/pu/img/VlbFB3v8H8VwzVNY.jpg,1,whippet,0.626152,True,borzoi,0.194742,True,Saluki,0.0273507,True,22149,124,110,4449,Oliver,1.3
16,888917238123831296,2017-07-23 00:22:39,This is Jim. He found a fren. Taught him how to sit like the good boys. 12/10 for both https://t.co/chxruIOUJN,https://twitter.com/dog_rates/status/888917238123831296/photo/1,,https://pbs.twimg.com/media/DFYRgsOUQAARGhO.jpg,1,golden_retriever,0.714719,True,Tibetan_mastiff,0.120184,True,Labrador_retriever,0.105506,True,25664,91,81,3769,Jim,1.2
17,888804989199671297,2017-07-22 16:56:37,This is Zeke. He has a new stick. Very proud of it. Would like you to throw it for him without taking it. 13/10 would do my best https://t.co/HTQ77yNQ5K,"https://twitter.com/dog_rates/status/888804989199671297/photo/1,https://twitter.com/dog_rates/status/888804989199671297/photo/1",,https://pbs.twimg.com/media/DFWra-3VYAA2piG.jpg,1,golden_retriever,0.46976,True,Labrador_retriever,0.184172,True,English_setter,0.0734817,True,22491,80,67,3544,Zeke,1.3
18,888554962724278272,2017-07-22 00:23:06,This is Ralphus. He's powering up. Attempting maximum borkdrive. 13/10 inspirational af https://t.co/YnYAFCTTiK,"https://twitter.com/dog_rates/status/888554962724278272/photo/1,https://twitter.com/dog_rates/status/888554962724278272/photo/1,https://twitter.com/dog_rates/status/888554962724278272/photo/1,https://twitter.com/dog_rates/status/888554962724278272/photo/1",,https://pbs.twimg.com/media/DFTH_O-UQAACu20.jpg,3,Siberian_husky,0.700377,True,Eskimo_dog,0.166511,True,malamute,0.111411,True,17340,61,71,2882,Ralphus,1.3
20,888078434458587136,2017-07-20 16:49:33,This is Gerald. He was just told he didn't get the job he interviewed for. A h*ckin injustice. 12/10 didn't want the job anyway https://t.co/DK7iDPfuRX,"https://twitter.com/dog_rates/status/888078434458587136/photo/1,https://twitter.com/dog_rates/status/888078434458587136/photo/1",,https://pbs.twimg.com/media/DFMWn56WsAAkA7B.jpg,1,French_bulldog,0.995026,True,pug,0.000931908,True,bull_mastiff,0.000903211,True,19168,170,94,2901,Gerald,1.2
21,887705289381826560,2017-07-19 16:06:48,This is Jeffrey. He has a monopoly on the pool noodles. Currently running a 'boop for two' midweek sale. 13/10 h*ckin strategic https://t.co/PhrUk20Q64,https://twitter.com/dog_rates/status/887705289381826560/photo/1,,https://pbs.twimg.com/media/DFHDQBbXgAEqY7t.jpg,1,basset,0.821664,True,redbone,0.0875815,True,Weimaraner,0.026236400000000003,True,26652,159,79,4542,Jeffrey,1.3
23,887473957103951883,2017-07-19 00:47:34,This is Canela. She attempted some fancy porch pics. They were unsuccessful. 13/10 someone help her https://t.co/cLyzpcUcMX,"https://twitter.com/dog_rates/status/887473957103951883/photo/1,https://twitter.com/dog_rates/status/887473957103951883/photo/1",,https://pbs.twimg.com/media/DFDw2tyUQAAAFke.jpg,2,Pembroke,0.809197,True,Rhodesian_ridgeback,0.05495,True,beagle,0.0389148,True,60242,588,213,15048,Canela,1.3
24,887343217045368832,2017-07-18 16:08:03,You may not have known you needed to see this today. 13/10 please enjoy (IG: emmylouroo) https://t.co/WZqNqygEyV,https://twitter.com/dog_rates/status/887343217045368832/video/1,,https://pbs.twimg.com/ext_tw_video_thumb/887343120832229379/pu/img/6HSuFrW1lzI_9Mht.jpg,1,Mexican_hairless,0.330741,True,sea_lion,0.275645,False,Weimaraner,0.134203,True,29617,539,179,8819,emmylouroo,1.3
25,887101392804085760,2017-07-18 00:07:08,This... is a Jubilant Antarctic House Bear. We only rate dogs. Please only send dogs. Thank you... 12/10 would suffocate in floof https://t.co/4Ad1jzJSdp,https://twitter.com/dog_rates/status/887101392804085760/photo/1,,https://pbs.twimg.com/media/DE-eAq6UwAA-jaE.jpg,1,Samoyed,0.733942,True,Eskimo_dog,0.0350295,True,Staffordshire_bullterrier,0.029704700000000007,True,27007,186,131,4998,nan,1.2
26,886983233522544640,2017-07-17 16:17:36,This is Maya. She's very shy. Rarely leaves her cup. 13/10 would find her an environment to thrive in https://t.co/I6oNy0CgiT,"https://twitter.com/dog_rates/status/886983233522544640/photo/1,https://twitter.com/dog_rates/status/886983233522544640/photo/1",,https://pbs.twimg.com/media/DE8yicJW0AAAvBJ.jpg,2,Chihuahua,0.793469,True,toy_terrier,0.143528,True,can_opener,0.0322529,False,30414,357,136,6326,Maya,1.3
27,886736880519319552,2017-07-16 23:58:41,"This is Mingus. He's a wonderful father to his smol pup. Confirmed 13/10, but he needs your help

https://t.co/bVi0Yr4Cff https://t.co/ISvKOSkd5b","https://www.gofundme.com/mingusneedsus,https://twitter.com/dog_rates/status/886736880519319552/photo/1,https://twitter.com/dog_rates/status/886736880519319552/photo/1",,https://pbs.twimg.com/media/DE5Se8FXcAAJFx4.jpg,1,kuvasz,0.309706,True,Great_Pyrenees,0.186136,True,Dandie_Dinmont,0.08634630000000001,True,10505,78,47,2635,Mingus,1.3
29,886366144734445568,2017-07-15 23:25:31,This is Roscoe. Another pupper fallen victim to spontaneous tongue ejections. Get the BlepiPen immediate. 12/10 deep breaths Roscoe https://t.co/RGE08MIJox,"https://twitter.com/dog_rates/status/886366144734445568/photo/1,https://twitter.com/dog_rates/status/886366144734445568/photo/1",pupper,https://pbs.twimg.com/media/DE0BTnQUwAApKEH.jpg,1,French_bulldog,0.999201,True,Chihuahua,0.000361178,True,Boston_bull,7.55616e-05,True,18562,117,73,2634,Roscoe,1.2
30,886258384151887873,2017-07-15 16:17:19,This is Waffles. His doggles are pupside down. Unsure how to fix. 13/10 someone assist Waffles https://t.co/xZDA9Qsq1O,https://twitter.com/dog_rates/status/886258384151887873/photo/1,,https://pbs.twimg.com/media/DEyfTG4UMAE4aE9.jpg,1,pug,0.943575,True,shower_cap,0.0252856,False,Siamese_cat,0.00284892,False,24553,215,102,5298,Waffles,1.3
31,885984800019947520,2017-07-14 22:10:11,Viewer discretion advised. This is Jimbo. He will rip ur finger right h*ckin off. Other dog clearly an accessory. 12/10 pls pet with caution https://t.co/BuveP0uMF1,https://twitter.com/dog_rates/status/885984800019947520/photo/1,,https://pbs.twimg.com/media/DEumeWWV0AA-Z61.jpg,1,Blenheim_spaniel,0.972494,True,Shih-Tzu,0.00663012,True,Bernese_mountain_dog,0.00623915,True,28636,173,122,5621,nan,1.2
32,885528943205470208,2017-07-13 15:58:47,This is Maisey. She fell asleep mid-excavation. Happens to the best of us. 13/10 would pat noggin approvingly https://t.co/tp1kQ8i9JF,https://twitter.com/dog_rates/status/885528943205470208/photo/1,,https://pbs.twimg.com/media/DEoH3yvXgAAzQtS.jpg,1,pug,0.369275,True,Labrador_retriever,0.265835,True,kuvasz,0.134697,True,31627,141,69,5336,Maisey,1.3
34,885167619883638784,2017-07-12 16:03:00,Here we have a corgi undercover as a malamute. Pawbably doing important investigative work. Zero control over tongue happenings. 13/10 https://t.co/44ItaMubBf,"https://twitter.com/dog_rates/status/885167619883638784/photo/1,https://twitter.com/dog_rates/status/885167619883638784/photo/1,https://twitter.com/dog_rates/status/885167619883638784/photo/1,https://twitter.com/dog_rates/status/885167619883638784/photo/1",,https://pbs.twimg.com/media/DEi_N9qXYAAgEEw.jpg,4,malamute,0.8124819999999999,True,Siberian_husky,0.0717125,True,Eskimo_dog,0.0557697,True,19274,316,131,3673,nan,1.3
35,884925521741709313,2017-07-12 00:01:00,"This is Earl. He found a hat. Nervous about what you think of it. 12/10 it's delightful, Earl https://t.co/MYJvdlNRVa",https://twitter.com/dog_rates/status/884925521741709313/photo/1,,https://pbs.twimg.com/media/DEfjEaNXkAAtPlj.jpg,1,Italian_greyhound,0.259916,True,American_Staffordshire_terrier,0.198451,True,Staffordshire_bullterrier,0.127725,True,67373,543,374,15046,Earl,1.2
36,884876753390489601,2017-07-11 20:47:12,This is Lola. It's her first time outside. Must test the earth and taste the atmosphere. 13/10 you're doing great Lola https://t.co/74TKAUsLkO,"https://twitter.com/dog_rates/status/884876753390489601/photo/1,https://twitter.com/dog_rates/status/884876753390489601/photo/1,https://twitter.com/dog_rates/status/884876753390489601/photo/1,https://twitter.com/dog_rates/status/884876753390489601/photo/1",,https://pbs.twimg.com/media/DEe2tZXXkAAwyX3.jpg,1,chow,0.822103,True,Norwich_terrier,0.106075,True,Norfolk_terrier,0.0373485,True,24415,186,106,4677,Lola,1.3
37,884562892145688576,2017-07-11 00:00:02,This is Kevin. He's just so happy. 13/10 what is your secret Kevin https://t.co/1r4MFCbCX5,https://twitter.com/dog_rates/status/884562892145688576/photo/1,,https://pbs.twimg.com/media/DEaZQkfXUAEC7qB.jpg,1,pug,0.5464060000000001,True,French_bulldog,0.404291,True,Brabancon_griffon,0.0440019,True,21346,209,105,3918,Kevin,1.3
38,884441805382717440,2017-07-10 15:58:53,"I present to you, Pup in Hat. Pup in Hat is great for all occasions. Extremely versatile. Compact as h*ck. 14/10 (IG: itselizabethgales) https://t.co/vvBOcC2VdC",https://twitter.com/dog_rates/status/884441805382717440/photo/1,,https://pbs.twimg.com/media/DEYrIZwWsAA2Wo5.jpg,1,Pembroke,0.993225,True,Cardigan,0.00321648,True,Chihuahua,0.00208089,True,23887,196,93,4796,itselizabethgales,1.4
39,884162670584377345,2017-07-09 21:29:42,Meet Yogi. He doesn't have any important dog meetings today he just enjoys looking his best at all times. 12/10 for dangerously dapper doggo https://t.co/YSI00BzTBZ,https://twitter.com/dog_rates/status/884162670584377345/photo/1,doggo,https://pbs.twimg.com/media/DEUtQbzW0AUTv_o.jpg,1,German_shepherd,0.707046,True,malinois,0.199396,True,Norwegian_elkhound,0.0491476,True,17960,75,68,2509,Yogi,1.2
40,883838122936631299,2017-07-09 00:00:04,This is Noah. He can't believe someone made this mess. Got the vacuum out for you though. Offered to help clean pup. 12/10 super good boy https://t.co/V85xujjDDY,https://twitter.com/dog_rates/status/883838122936631299/photo/1,,https://pbs.twimg.com/media/DEQGFgAXUAAEvfi.jpg,1,Doberman,0.610946,True,miniature_pinscher,0.299603,True,kelpie,0.0630203,True,19197,116,112,2867,Noah,1.2
41,883482846933004288,2017-07-08 00:28:19,"This is Bella. She hopes her smile made you smile. If not, she is also offering you her favorite monkey. 13.5/10 https://t.co/qjrljjt948","https://twitter.com/dog_rates/status/883482846933004288/photo/1,https://twitter.com/dog_rates/status/883482846933004288/photo/1",,https://pbs.twimg.com/media/DELC9dZXUAADqUk.jpg,1,golden_retriever,0.943082,True,Labrador_retriever,0.032409,True,kuvasz,0.00550072,True,40251,303,177,8279,Bella,1.35
42,883360690899218434,2017-07-07 16:22:55,Meet Grizzwald. He may be the floofiest floofer I ever did see. Lost eyes saving a schoolbus from a volcano erpuption. 13/10 heroic as h*ck https://t.co/rf661IFEYP,https://twitter.com/dog_rates/status/883360690899218434/photo/1,floofer,https://pbs.twimg.com/media/DEJT3FeXoAAtwUy.jpg,1,chow,0.987997,True,Tibetan_mastiff,0.00709872,True,Newfoundland,0.00214033,True,19967,130,129,3086,Grizzwald,1.3
43,883117836046086144,2017-07-07 00:17:54,"Please only send dogs. We don't rate mechanics, no matter how h*ckin good. Thank you... 13/10 would sneak a pat https://t.co/Se5fZ9wp5E","https://twitter.com/dog_rates/status/883117836046086144/photo/1,https://twitter.com/dog_rates/status/883117836046086144/photo/1",,https://pbs.twimg.com/media/DEF2-_hXoAAs62q.jpg,2,golden_retriever,0.949562,True,Labrador_retriever,0.045947900000000014,True,kuvasz,0.00247094,True,32543,110,77,5543,nan,1.3
44,882992080364220416,2017-07-06 15:58:11,This is Rusty. He wasn't ready for the first pic. Clearly puppared for the second. 13/10 confirmed great boy https://t.co/tyER0KpdXj,"https://twitter.com/dog_rates/status/882992080364220416/photo/1,https://twitter.com/dog_rates/status/882992080364220416/photo/1",,https://pbs.twimg.com/media/DEEEnIqXYAAiJh_.jpg,1,Eskimo_dog,0.466778,True,Siberian_husky,0.406044,True,dingo,0.07341439999999999,False,21003,53,56,3250,Rusty,1.3
45,882762694511734784,2017-07-06 00:46:41,This is Gus. He's quite the cheeky pupper. Already perfected the disinterested wink. 12/10 would let steal my girl https://t.co/D43I96SlVu,https://twitter.com/dog_rates/status/882762694511734784/photo/1,pupper,https://pbs.twimg.com/media/DEAz_HHXsAA-p_z.jpg,1,Labrador_retriever,0.85005,True,Chesapeake_Bay_retriever,0.074257,True,flat-coated_retriever,0.015579399999999997,True,24827,123,83,4106,Gus,1.2
46,882627270321602560,2017-07-05 15:48:34,This is Stanley. He has his first swim lesson today. Doggle straps adjusted. Ready to go. 13/10 Phelps is nervous (IG: stanleythe_corgi) https://t.co/Nx52PGwH94,https://twitter.com/dog_rates/status/882627270321602560/photo/1,,https://pbs.twimg.com/media/DD-40X3WAAAJPU5.jpg,1,Pembroke,0.542982,True,Chihuahua,0.251988,True,Cardigan,0.107699,True,24621,262,120,5072,Stanley,1.3
47,882268110199369728,2017-07-04 16:01:23,This is Alfy. You're witnessing his first watermelon experience. I think it was a success. 13/10 happy 4th Alfy ðŸ‡ºðŸ‡¸ https://t.co/fYP5RlutfA,"https://twitter.com/dog_rates/status/882268110199369728/photo/1,https://twitter.com/dog_rates/status/882268110199369728/photo/1,https://twitter.com/dog_rates/status/882268110199369728/photo/1",,https://pbs.twimg.com/media/DD5yKdPW0AArzX8.jpg,1,golden_retriever,0.762211,True,Labrador_retriever,0.0989849,True,cocker_spaniel,0.0171995,True,39237,308,128,9649,Alfy,1.3
48,882045870035918850,2017-07-04 01:18:17,"This is Koko. Her owner, inspired by Barney, recently built a cart for her to use during walks if she got tired. 13/10 rest easy Koko https://t.co/zeDpnsKX7w","https://twitter.com/dog_rates/status/882045870035918850/photo/1,https://twitter.com/dog_rates/status/882045870035918850/photo/1,https://twitter.com/dog_rates/status/882045870035918850/photo/1,https://twitter.com/dog_rates/status/882045870035918850/photo/1",,https://pbs.twimg.com/media/DD2oCl2WAAEI_4a.jpg,1,web_site,0.949591,False,dhole,0.0173258,False,golden_retriever,0.00694063,True,25755,1252,403,4089,Koko,1.3
49,881906580714921986,2017-07-03 16:04:48,This is Rey. He's a Benebop Cumberfloof. 12/10 dangerously pettable https://t.co/503CgWbhxQ,https://twitter.com/dog_rates/status/881906580714921986/photo/1,,https://pbs.twimg.com/media/DD0pWm9XcAAeSBL.jpg,1,Weimaraner,0.291539,True,Chesapeake_Bay_retriever,0.278966,True,koala,0.12701700000000002,False,21460,132,98,2858,Rey,1.2
50,881666595344535552,2017-07-03 00:11:11,This is Gary. He couldn't miss this puppertunity for a selfie. Flawless focusing skills. 13/10 would boop intensely https://t.co/7CSWCl8I6s,https://twitter.com/dog_rates/status/881666595344535552/photo/1,,https://pbs.twimg.com/media/DDxPFwbWAAEbVVR.jpg,1,Saluki,0.529012,True,Afghan_hound,0.25000300000000003,True,golden_retriever,0.16073900000000002,True,44590,274,151,8969,Gary,1.3
51,881536004380872706,2017-07-02 15:32:16,"Here is a pupper approaching maximum borkdrive. Zooming at never before seen speeds. 14/10 paw-inspiring af 
(IG: puffie_the_chow) https://t.co/ghXBIIeQZF",https://twitter.com/dog_rates/status/881536004380872706/video/1,pupper,https://pbs.twimg.com/ext_tw_video_thumb/881535971568889856/pu/img/9bawiZ--8FKywTkz.jpg,1,Samoyed,0.281463,True,Angora,0.272066,False,Persian_cat,0.114854,False,43494,1224,428,13420,puffie,1.4
54,880872448815771648,2017-06-30 19:35:32,Ugh not again. We only rate dogs. Please don't send in well-dressed  floppy-tongued street penguins. Dogs only please. Thank you... 12/10 https://t.co/WiAMbTkDPf,https://twitter.com/dog_rates/status/880872448815771648/photo/1,,https://pbs.twimg.com/media/DDl8zzJW0AAisCJ.jpg,1,Pembroke,0.791416,True,Norwich_terrier,0.0613929,True,Chihuahua,0.0337257,True,18724,111,83,3205,nan,1.2
55,880465832366813184,2017-06-29 16:39:47,This is Bella. She had her first beach experience this morning. Complete success. 12/10 would perform a sandy boop https://t.co/4VsFysDmiw,"https://twitter.com/dog_rates/status/880465832366813184/photo/1,https://twitter.com/dog_rates/status/880465832366813184/photo/1,https://twitter.com/dog_rates/status/880465832366813184/photo/1,https://twitter.com/dog_rates/status/880465832366813184/photo/1",,https://pbs.twimg.com/media/DDgK-J4XUAIEV9W.jpg,1,golden_retriever,0.913255,True,Labrador_retriever,0.0263286,True,cocker_spaniel,0.00937082,True,25041,222,123,5221,Bella,1.2
56,880221127280381952,2017-06-29 00:27:25,Meet Jesse. He's a Fetty Woof. His tongue ejects without warning. A true bleptomaniac. 12/10 would snug well https://t.co/fUod0tVmvK,"https://twitter.com/dog_rates/status/880221127280381952/photo/1,https://twitter.com/dog_rates/status/880221127280381952/photo/1",,https://pbs.twimg.com/media/DDcscbXU0AIfDzs.jpg,1,Chihuahua,0.238525,True,meerkat,0.104256,False,clumber,0.0525803,True,23687,201,107,3474,Jesse,1.2
57,880095782870896641,2017-06-28 16:09:20,Please don't send in photos without dogs in them. We're not @porch_rates. Insubordinate and churlish. Pretty good porch tho 11/10 https://t.co/HauE8M3Bu4,https://twitter.com/dog_rates/status/880095782870896641/photo/1,,https://pbs.twimg.com/media/DDa6ckbXgAAM1vV.jpg,1,miniature_pinscher,0.120298,True,Rhodesian_ridgeback,0.106395,True,beagle,0.106073,True,24360,172,147,3658,nan,1.1
58,879862464715927552,2017-06-28 00:42:13,This is Romeo. He would like to do an entrance. Requesting your immediate assistance. 13/10 https://t.co/Qh5aEkRQm9,"https://twitter.com/dog_rates/status/879862464715927552/photo/1,https://twitter.com/dog_rates/status/879862464715927552/photo/1,https://twitter.com/dog_rates/status/879862464715927552/photo/1",,https://pbs.twimg.com/media/DDXmPrbWAAEKMvy.jpg,3,basset,0.813507,True,beagle,0.146654,True,cocker_spaniel,0.00948502,True,19727,82,70,2935,Romeo,1.3
59,879492040517615616,2017-06-27 00:10:17,This is Bailey. He thinks you should measure ear length for signs of growth instead. 12/10 https://t.co/IxM9IMKQq8,https://twitter.com/dog_rates/status/879492040517615616/photo/1,,https://pbs.twimg.com/media/DDSVWMvXsAEgmMK.jpg,1,German_short-haired_pointer,0.479896,True,vizsla,0.124353,True,bath_towel,0.0733202,False,20719,130,69,2630,Bailey,1.2
60,879415818425184262,2017-06-26 19:07:24,This is Duddles. He did an attempt. 13/10 someone help him (vid by Georgia Felici) https://t.co/UDT7ZkcTgY,https://twitter.com/dog_rates/status/879415818425184262/video/1,,https://pbs.twimg.com/ext_tw_video_thumb/879415784908390401/pu/img/cX7XI1TnUsseGET5.jpg,1,English_springer,0.383404,True,Boston_bull,0.134967,True,Cardigan,0.110481,True,92961,4353,1123,37497,Duddles,1.3
61,879376492567855104,2017-06-26 16:31:08,This is Jack AKA Stephen Furry. You're not scoring on him. Unless he slips down the slide. 12/10 would happily get blocked by https://t.co/0gOi601EAa,https://twitter.com/dog_rates/status/879376492567855104/photo/1,,https://pbs.twimg.com/media/DDQsQGFV0AAw6u9.jpg,1,tricycle,0.663601,False,Labrador_retriever,0.0334961,True,Pembroke,0.0188266,True,14873,106,49,2656,Jack,1.2
63,879008229531029506,2017-06-25 16:07:47,This is Beau. That is Beau's balloon. He takes it everywhere. 13/10 would protect at all costs https://t.co/YDtpCjIPKN,https://twitter.com/dog_rates/status/879008229531029506/photo/1,,https://pbs.twimg.com/media/DDLdUrqXYAMOVzY.jpg,1,vizsla,0.960513,True,miniature_pinscher,0.00943065,True,American_Staffordshire_terrier,0.0087113,True,16803,56,37,2246,Beau,1.3
