index,tweet_id,timestamp,text,expanded_urls,dog_stage,jpg_url,img_num,p1,p1_conf,p1_dog,p2,p2_conf,p2_dog,p3,p3_conf,p3_dog,like_count,quote_count,reply_count,retweet_count,name,rating
1435,681297372102656000,2015-12-28 02:15:26,"This is actually a lion. We only rate dogs. For the last time please only send dogs. Thank u.
12/10 would still pet https://t.co/Pp26dMQxap",https://twitter.com/dog_rates/status/681297372102656000/photo/1,,https://pbs.twimg.com/media/CXR0WJ_W8AMd_O8.jpg,1,Lhasa,0.482401,True,Shih-Tzu,0.113672,True,Pomeranian,0.0962286,True,2967,0,22,859,nan,1.2
1436,681281657291280384,2015-12-28 01:12:59,Meet Sarge. His parents signed him up for dancing lessons but his true passion is roller coasters 11/10 very petable https://t.co/KvVoBIgkje,https://twitter.com/dog_rates/status/681281657291280384/photo/1,,https://pbs.twimg.com/media/CXRmDfWWMAADCdc.jpg,1,Saint_Bernard,0.99883,True,Pekinese,0.000391312,True,Great_Pyrenees,0.000223582,True,2976,0,15,1000,Sarge,1.1
1437,681261549936340994,2015-12-27 23:53:05,Say hello to Panda. He's a Quackadilly Shooster. Not amused by your fake ball throwing motion. 9/10 would hug lots https://t.co/wL1iDvbcVk,https://twitter.com/dog_rates/status/681261549936340994/photo/1,,https://pbs.twimg.com/media/CXRTw_5WMAAUDVp.jpg,1,Tibetan_terrier,0.382101,True,miniature_poodle,0.0954294,True,Maltese_dog,0.0657377,True,1335,0,4,237,nan,0.9
1439,681231109724700672,2015-12-27 21:52:07,I just love this pic. 11/10 this pupper is going places https://t.co/P16uhh1PbI,https://twitter.com/dog_rates/status/681231109724700672/photo/1,pupper,https://pbs.twimg.com/media/CXQ4EwQWwAEVaUf.jpg,1,Irish_setter,0.406047,True,cocker_spaniel,0.345646,True,Airedale,0.147912,True,2245,0,12,441,nan,1.1
1440,681193455364796417,2015-12-27 19:22:30,This is Aspen. He's astronomically fluffy. I wouldn't stop petting this dog if the world was ending around me 11/10 https://t.co/oBlgL9nxpx,"https://twitter.com/dog_rates/status/681193455364796417/photo/1,https://twitter.com/dog_rates/status/681193455364796417/photo/1",,https://pbs.twimg.com/media/CXQV03pWYAAVniz.jpg,1,Pomeranian,0.992619,True,keeshond,0.00435645,True,schipperke,0.000814,True,3426,0,26,1343,Aspen,1.1
1441,680970795137544192,2015-12-27 04:37:44,I thought I made this very clear. We only rate dogs. Stop sending other things like this shark. Thank you... 9/10 https://t.co/CXSJZ4Stk3,https://twitter.com/dog_rates/status/680970795137544192/photo/1,,https://pbs.twimg.com/media/CXNLU6wWkAE0OkJ.jpg,1,pug,0.713102,True,whippet,0.05742630000000001,True,quilt,0.0560181,False,2218,0,24,586,nan,0.9
1442,680959110691590145,2015-12-27 03:51:18,This is Ozzie. He was doing fine until he lost traction in those festive socks. Now he's tired. 9/10 still killin it https://t.co/u4FYdIRKnY,"https://twitter.com/dog_rates/status/680959110691590145/photo/1,https://twitter.com/dog_rates/status/680959110691590145/photo/1,https://twitter.com/dog_rates/status/680959110691590145/photo/1",,https://pbs.twimg.com/media/CXNAsm6WsAEST9R.jpg,2,carousel,0.500992,False,feather_boa,0.06439,False,pug,0.0443565,True,4231,0,25,1826,Ozzie,0.9
1443,680940246314430465,2015-12-27 02:36:20,This is Alice. She's an idiot. 4/10 https://t.co/VQXdwJfkyS,https://twitter.com/dog_rates/status/680940246314430465/photo/1,,https://pbs.twimg.com/media/CXMvio7WQAAPZJj.jpg,1,soft-coated_wheaten_terrier,0.289598,True,West_Highland_white_terrier,0.157195,True,toy_poodle,0.07443469999999999,True,2931,2,50,939,Alice,0.4
1444,680934982542561280,2015-12-27 02:15:25,Say hello to Sadie. She's a Tortellini Sidewinder. Very jubilant pup. Seems loyal. Leaves on point. 10/10 petable af https://t.co/g2bTu4ayPl,https://twitter.com/dog_rates/status/680934982542561280/photo/1,,https://pbs.twimg.com/media/CXMqwIQWcAA2iE0.jpg,1,Labrador_retriever,0.7843979999999999,True,Siberian_husky,0.0559251,True,beagle,0.0227501,True,1925,0,17,395,nan,1.0
1445,680913438424612864,2015-12-27 00:49:49,Meet Griswold. He's dapper as hell. Already pumped for next Christmas. 11/10 https://t.co/5NrpNDyFzN,https://twitter.com/dog_rates/status/680913438424612864/photo/1,,https://pbs.twimg.com/media/CXMXKKHUMAA1QN3.jpg,1,Pomeranian,0.615678,True,golden_retriever,0.12645499999999998,True,Chihuahua,0.0871836,True,2220,0,14,565,Griswold,1.1
1446,680889648562991104,2015-12-26 23:15:17,This is Cheesy. It's her birthday. She's patiently waiting to eat her party muffin. 9/10 happy birthday pup https://t.co/cH2H7mch2H,https://twitter.com/dog_rates/status/680889648562991104/photo/1,,https://pbs.twimg.com/media/CXMBhXfWEAA4mMI.jpg,1,Shetland_sheepdog,0.876337,True,collie,0.078331,True,Pomeranian,0.0204075,True,1616,0,11,327,Cheesy,0.9
1447,680836378243002368,2015-12-26 19:43:36,This is Ellie. She's secretly ferocious. 12/10 very deadly pupper https://t.co/BF4BW8LUgb,"https://twitter.com/dog_rates/status/680836378243002368/photo/1,https://twitter.com/dog_rates/status/680836378243002368/photo/1,https://twitter.com/dog_rates/status/680836378243002368/photo/1",pupper,https://pbs.twimg.com/media/CXLREjOW8AElfk6.jpg,3,Pembroke,0.427781,True,Shetland_sheepdog,0.160669,True,Pomeranian,0.11125,True,3196,1,27,1185,Ellie,1.2
1448,680801747103793152,2015-12-26 17:25:59,Great picture here. Dog on the right panicked &amp; forgot about his tongue. Middle green dog must've fainted. All 10/10 https://t.co/31npKUAox0,https://twitter.com/dog_rates/status/680801747103793152/photo/1,,https://pbs.twimg.com/media/CXKxkseW8AAjAMY.jpg,1,pug,0.99672,True,Labrador_retriever,0.00143879,True,Staffordshire_bullterrier,0.000517603,True,2196,0,15,743,nan,1.0
1450,680609293079592961,2015-12-26 04:41:15,This is Brody. That is his chair. He loves his chair. Never leaves it. 9/10 might be stuck actually https://t.co/WvJRg0XJit,https://twitter.com/dog_rates/status/680609293079592961/photo/1,,https://pbs.twimg.com/media/CXICiB9UwAE1sKY.jpg,1,French_bulldog,0.700764,True,Chihuahua,0.07238960000000001,True,American_Staffordshire_terrier,0.039618699999999986,True,2415,0,21,629,Brody,0.9
1452,680497766108381184,2015-12-25 21:18:05,Meet Percy. He's a Latvian Yuletide Heineken. Refuses to take off sweater. Kinda feisty. 12/10 would keep in pocket https://t.co/QGM5Fcuv7s,https://twitter.com/dog_rates/status/680497766108381184/photo/1,,https://pbs.twimg.com/media/CXGdG0aWcAEbOO1.jpg,1,Chihuahua,0.538354,True,muzzle,0.0842887,False,ski_mask,0.07669010000000001,False,3898,1,36,1738,Percy,1.2
1453,680494726643068929,2015-12-25 21:06:00,Here we have uncovered an entire battalion of holiday puppers. Average of 11.26/10 https://t.co/eNm2S6p9BD,https://twitter.com/dog_rates/status/680494726643068929/photo/1,,https://pbs.twimg.com/media/CXGaVxOWAAADjhF.jpg,1,kuvasz,0.438627,True,Samoyed,0.111622,True,Great_Pyrenees,0.0640608,True,1577,0,3,440,nan,1.126
1454,680473011644985345,2015-12-25 19:39:43,"This is Hector. He thinks he's a hammer. Silly Hector. You're a pupper, not a hammer. 10/10 https://t.co/OdUFuZIXiI",https://twitter.com/dog_rates/status/680473011644985345/photo/1,pupper,https://pbs.twimg.com/media/CXGGlzvWYAArPfk.jpg,1,Lakeland_terrier,0.796694,True,West_Highland_white_terrier,0.138709,True,Norwich_terrier,0.016253399999999998,True,2349,1,18,674,Hector,1.0
1458,680191257256136705,2015-12-25 01:00:07,Here's a sleepy Christmas pupper 11/10 https://t.co/KXg0f8GNQ9,https://twitter.com/dog_rates/status/680191257256136705/photo/1,pupper,https://pbs.twimg.com/media/CXCGVXyWsAAAVHE.jpg,1,Brittany_spaniel,0.7332529999999999,True,Welsh_springer_spaniel,0.251634,True,English_springer,0.00924321,True,1985,0,8,445,nan,1.1
1460,680161097740095489,2015-12-24 23:00:17,Meet Goliath. He's an example of irony. Head is phenomenally round. Wants to be an ornament. 12/10 would hug gently https://t.co/72Dil0Aktw,https://twitter.com/dog_rates/status/680161097740095489/photo/1,,https://pbs.twimg.com/media/CXBq6RPWkAAaNuU.jpg,1,bluetick,0.268681,True,miniature_pinscher,0.125652,True,English_setter,0.0893727,True,2147,0,10,673,Goliath,1.2
1461,680145970311643136,2015-12-24 22:00:10,Say hello to Kawhi. He was doing fine until his hat fell off. He got it back though. 10/10 deep breaths pupper https://t.co/N5pM6WBx7e,"https://twitter.com/dog_rates/status/680145970311643136/photo/1,https://twitter.com/dog_rates/status/680145970311643136/photo/1,https://twitter.com/dog_rates/status/680145970311643136/photo/1",pupper,https://pbs.twimg.com/media/CXBdJxLUsAAWql2.jpg,1,miniature_poodle,0.457117,True,toy_poodle,0.226481,True,Maltese_dog,0.0676815,True,3315,0,16,1564,nan,1.0
1462,680130881361686529,2015-12-24 21:00:12,This is Reggie. His Santa hat is a little big. 10/10 he's still having fun https://t.co/w0dcGXq7qK,https://twitter.com/dog_rates/status/680130881361686529/photo/1,,https://pbs.twimg.com/media/CXBPbVtWAAA2Vus.jpg,1,Maltese_dog,0.199121,True,West_Highland_white_terrier,0.197897,True,Shih-Tzu,0.15713,True,2120,1,5,858,Reggie,1.0
1463,680115823365742593,2015-12-24 20:00:22,This is Ozzy. He woke up 2 minutes before he had to be ready for the Christmas party. 9/10 classic Ozzy https://t.co/Kt9vmw0Fap,https://twitter.com/dog_rates/status/680115823365742593/photo/1,,https://pbs.twimg.com/media/CXBBurSWMAELewi.jpg,1,pug,0.999365,True,French_bulldog,0.000543615,True,Boston_bull,2.8152800000000006e-05,True,2502,0,17,830,Ozzy,0.9
1464,680100725817409536,2015-12-24 19:00:23,This pupper is not coming inside until she catches a snowflake on her tongue. 11/10 the determination is palpable https://t.co/lvMYbmKq8H,https://twitter.com/dog_rates/status/680100725817409536/photo/1,pupper,https://pbs.twimg.com/media/CW-loUBWYAAn2Cb.jpg,1,golden_retriever,0.6989609999999999,True,chow,0.14597100000000002,True,Pomeranian,0.034888,True,3309,0,18,1254,nan,1.1
1466,680070545539371008,2015-12-24 17:00:27,Say hello to Emmie. She's trapped in an ornament. Tragic af. Looks pretty content tho. Maybe it's meant to be. 9/10 https://t.co/Fh7geodBCU,https://twitter.com/dog_rates/status/680070545539371008/photo/1,,https://pbs.twimg.com/media/CW-dU34WQAANBGy.jpg,1,earthstar,0.127701,False,Shih-Tzu,0.121811,True,bubble,0.11782,False,2390,0,26,778,nan,0.9
1469,679862121895714818,2015-12-24 03:12:15,"""Dammit hooman I'm jus trynna lik the fler"" 11/10 https://t.co/eRZRI8OTj7",https://twitter.com/dog_rates/status/679862121895714818/photo/1,,https://pbs.twimg.com/media/CW9a_h1WwAApmAy.jpg,1,EntleBucher,0.5232060000000001,True,Greater_Swiss_Mountain_dog,0.431657,True,Appenzeller,0.0442079,True,2257,0,10,557,nan,1.1
1470,679854723806179328,2015-12-24 02:42:51,This is Bruce. He's a rare pup. Covered in Frosted Flakes. Nifty gold teeth. Overall good dog. 7/10 would pet firmly https://t.co/RtxxACzZ8A,https://twitter.com/dog_rates/status/679854723806179328/photo/1,,https://pbs.twimg.com/media/CW9UQ7oWkAAErmU.jpg,1,llama,0.887963,False,ram,0.0950207,False,chow,0.00230739,True,2617,1,33,1105,Bruce,0.7
1471,679844490799091713,2015-12-24 02:02:12,This is Willie. He's floating away and needs your assistance. Please someone help Willie. 10/10 https://t.co/MJqygWqt8X,https://twitter.com/dog_rates/status/679844490799091713/photo/1,,https://pbs.twimg.com/media/CW9K9VeVAAE0j-x.jpg,1,Airedale,0.903832,True,Border_terrier,0.0347126,True,toy_poodle,0.021378,True,2188,0,27,687,Willie,1.0
1472,679828447187857408,2015-12-24 00:58:27,Everybody look at this beautiful pupper 13/10 https://t.co/hyAC5Hq9GC,"https://twitter.com/dog_rates/status/679828447187857408/photo/1,https://twitter.com/dog_rates/status/679828447187857408/photo/1,https://twitter.com/dog_rates/status/679828447187857408/photo/1",pupper,https://pbs.twimg.com/media/CW88XN4WsAAlo8r.jpg,3,Chihuahua,0.346545,True,dalmatian,0.166246,True,toy_terrier,0.117502,True,33244,145,168,12636,nan,1.3
1473,679777920601223168,2015-12-23 21:37:40,This is Rinna. She's melting. 10/10 get inside pupper https://t.co/PA0czwucsb,https://twitter.com/dog_rates/status/679777920601223168/photo/1,pupper,https://pbs.twimg.com/media/CW8OYajUMAAPRoF.jpg,1,bloodhound,0.5288189999999999,True,bull_mastiff,0.420119,True,French_bulldog,0.00948059,True,2861,0,14,998,Rinna,1.0
1474,679736210798047232,2015-12-23 18:51:56,This pup's name is Sabertooth (parents must be cool). Ears for days. Jumps unannounced. 9/10 would pet diligently https://t.co/iazoiNUviP,https://twitter.com/dog_rates/status/679736210798047232/photo/1,,https://pbs.twimg.com/media/CW7oelWWcAAhyzz.jpg,1,French_bulldog,0.319139,True,Chihuahua,0.154088,True,Cardigan,0.117688,True,1917,1,26,719,Sabertooth,0.9
1475,679729593985699840,2015-12-23 18:25:38,This is Hunter. He was playing with his ball minding his own business. Has no idea what happened to the carpet. 8/10 https://t.co/DbUTDI3u1R,https://twitter.com/dog_rates/status/679729593985699840/photo/1,,https://pbs.twimg.com/media/CW7iddWUsAElUC0.jpg,1,wallaby,0.164215,False,West_Highland_white_terrier,0.0935148,True,ashcan,0.0672783,False,1996,0,30,751,Hunter,0.8
1476,679722016581222400,2015-12-23 17:55:32,This is Mike. He is a Jordanian Frito Pilates. Frowning because he can't see directly in front of him. 8/10 https://t.co/NL5QJwdEpF,https://twitter.com/dog_rates/status/679722016581222400/photo/1,,https://pbs.twimg.com/media/CW7bkW6WQAAksgB.jpg,1,boxer,0.459604,True,Boston_bull,0.197913,True,French_bulldog,0.0870225,True,1543,0,22,426,Mike,0.8
1477,679530280114372609,2015-12-23 05:13:38,Guys this really needs to stop. We've been over this way too many times. This is a giraffe. We only rate dogs.. 7/10 https://t.co/yavgkHYPOC,https://twitter.com/dog_rates/status/679530280114372609/photo/1,,https://pbs.twimg.com/media/CW4tL1vWcAIw1dw.jpg,1,dalmatian,0.750256,True,jaguar,0.169007,False,zebra,0.00648149,False,4380,0,52,1889,nan,0.7
1479,679511351870550016,2015-12-23 03:58:25,Say hello to William. He makes fun of others because he's terrified of his own deep-seated insecurities. 7/10 https://t.co/bwuV6FlRxr,https://twitter.com/dog_rates/status/679511351870550016/photo/1,,https://pbs.twimg.com/media/CW4b-GUWYAAa8QO.jpg,1,Chihuahua,0.761972,True,black-footed_ferret,0.150605,False,squirrel_monkey,0.028147900000000007,False,3078,0,26,1150,nan,0.7
1481,679475951516934144,2015-12-23 01:37:45,This is Evy. She doesn't want to be a Koala. 9/10 https://t.co/VITeF0Kl9L,https://twitter.com/dog_rates/status/679475951516934144/photo/1,,https://pbs.twimg.com/media/CW37xZbUoAAUXe5.jpg,1,Maltese_dog,0.145742,True,toy_poodle,0.139407,True,West_Highland_white_terrier,0.108821,True,1929,0,21,585,Evy,0.9
1482,679462823135686656,2015-12-23 00:45:35,Meet Hurley. He's the curly one. He hugs every other dog he sees during his walk. 11/10 for spreading the love https://t.co/M6vqkt2GKV,https://twitter.com/dog_rates/status/679462823135686656/photo/1,,https://pbs.twimg.com/media/CW3v1KxW8AAIOuy.jpg,1,toy_poodle,0.62178,True,miniature_poodle,0.197819,True,soft-coated_wheaten_terrier,0.046745,True,29472,211,202,17054,Hurley,1.1
1483,679158373988876288,2015-12-22 04:35:49,This is Rubio. He has too much skin. 11/10 https://t.co/NLOHmlENag,https://twitter.com/dog_rates/status/679158373988876288/photo/1,,https://pbs.twimg.com/media/CWza7kpWcAAdYLc.jpg,1,pug,0.27220500000000003,True,bull_mastiff,0.25153000000000003,True,bath_towel,0.116806,False,19479,85,190,7260,Rubio,1.1
1484,679148763231985668,2015-12-22 03:57:37,I know everyone's excited for Christmas but that doesn't mean you can send in reindeer. We only rate dogs... 8/10 https://t.co/eWjWgbOCYL,https://twitter.com/dog_rates/status/679148763231985668/photo/1,,https://pbs.twimg.com/media/CWzSMmAWsAAyB1u.jpg,1,Italian_greyhound,0.302685,True,hair_slide,0.124281,False,Afghan_hound,0.059846,True,2558,0,20,928,nan,0.8
1485,679132435750195208,2015-12-22 02:52:45,This is Louis. He's a river dancer. His friends think it's badass. All are very supportive. 10/10 for Louis https://t.co/qoIvjKMY58,https://twitter.com/dog_rates/status/679132435750195208/photo/1,,https://pbs.twimg.com/media/CWzDWOkXAAAP0k7.jpg,1,Scottish_deerhound,0.19461,True,Irish_wolfhound,0.162855,True,giant_schnauzer,0.15983699999999998,True,2713,1,22,1037,Louis,1.0
1486,679111216690831360,2015-12-22 01:28:25,This is officially the greatest yawn of all time. 12/10 https://t.co/4R0Cc0sLVE,https://twitter.com/dog_rates/status/679111216690831360/video/1,,https://pbs.twimg.com/ext_tw_video_thumb/679111114081370114/pu/img/hFca8BHjRopgD0cM.jpg,1,kelpie,0.189423,True,beagle,0.121988,True,basset,0.121171,True,5445,2,77,2316,nan,1.2
1487,679062614270468097,2015-12-21 22:15:18,This is Chompsky. He lives up to his name. 11/10 https://t.co/Xl37lQEWd0,"https://twitter.com/dog_rates/status/679062614270468097/photo/1,https://twitter.com/dog_rates/status/679062614270468097/photo/1",,https://pbs.twimg.com/media/CWyD2HGUYAQ1Xa7.jpg,2,cash_machine,0.802333,False,schipperke,0.0455186,True,German_shepherd,0.0233535,True,15515,76,82,7224,Chompsky,1.1
1488,679047485189439488,2015-12-21 21:15:11,This dog doesn't know how to stairs. Quite tragic really. 9/10 get it together pup https://t.co/kTpr9PTMg1,https://twitter.com/dog_rates/status/679047485189439488/photo/1,,https://pbs.twimg.com/media/CWx2FaLWcAEQ3vh.jpg,1,panpipe,0.962572,False,bannister,0.0252482,False,golden_retriever,0.00293035,True,2059,0,23,588,nan,0.9
1489,678991772295516161,2015-12-21 17:33:48,If your Monday isn't going so well just take a look at this. Both 12/10 https://t.co/GJT6SILPGU,https://twitter.com/dog_rates/status/678991772295516161/photo/1,,https://pbs.twimg.com/media/CWxDaXHWsAAWV8W.jpg,1,Eskimo_dog,0.330216,True,Siberian_husky,0.187003,True,Chihuahua,0.10142,True,2077,0,28,1019,nan,1.2
1490,678969228704284672,2015-12-21 16:04:13,Meet Lola. She's a Metamorphic Chartreuse. Plays with her food. Insubordinate and churlish. Exquisite hardwood 11/10 https://t.co/etpBNXwN7f,https://twitter.com/dog_rates/status/678969228704284672/photo/1,,https://pbs.twimg.com/media/CWwu6OLUkAEo3gq.jpg,1,Labrador_retriever,0.680251,True,Chesapeake_Bay_retriever,0.201697,True,golden_retriever,0.019675900000000003,True,1498,0,15,410,Lola,1.1
1491,678800283649069056,2015-12-21 04:52:53,Here's a pupper with some mean tan lines. Snazzy sweater though 12/10 https://t.co/DpCSVsl6vu,https://twitter.com/dog_rates/status/678800283649069056/photo/1,pupper,https://pbs.twimg.com/media/CWuVQSLW4AAI3w9.jpg,1,Labrador_retriever,0.213673,True,beagle,0.146235,True,Airedale,0.122701,True,2360,0,16,821,nan,1.2
1492,678798276842360832,2015-12-21 04:44:55,This is Linda. She fucking hates trees. 7/10 https://t.co/blaY85FIxR,https://twitter.com/dog_rates/status/678798276842360832/photo/1,,https://pbs.twimg.com/media/CWuTbAKUsAAvZHh.jpg,1,Airedale,0.583122,True,silky_terrier,0.12956700000000002,True,Lakeland_terrier,0.0947266,True,3169,2,31,1031,Linda,0.7
1493,678774928607469569,2015-12-21 03:12:08,This is Tug. He's not required to wear the cone he just wants his voice to project more clearly. 11/10 https://t.co/Sp739Ou2qx,https://twitter.com/dog_rates/status/678774928607469569/photo/1,,https://pbs.twimg.com/media/CWt-MNIWEAAUC9S.jpg,1,Pembroke,0.194681,True,toy_poodle,0.121821,True,Pomeranian,0.096843,True,2576,0,12,822,Tug,1.1
1495,678764513869611008,2015-12-21 02:30:45,"Meet Wilson. He got caught humping the futon. He's like ""dude, help me out here"" 10/10 I'd help Wilson out https://t.co/m6XoclB0qv",https://twitter.com/dog_rates/status/678764513869611008/photo/1,,https://pbs.twimg.com/media/CWt0ubZWcAAkFER.jpg,1,Irish_terrier,0.696646,True,Australian_terrier,0.0749616,True,Irish_setter,0.06390119999999999,True,1483,0,9,418,Wilson,1.0
1496,678755239630127104,2015-12-21 01:53:54,This is Dash. He didn't think the water would be that cold. Damn it Dash it's December. Think a little. 10/10 https://t.co/NqcOwG8pxW,https://twitter.com/dog_rates/status/678755239630127104/photo/1,,https://pbs.twimg.com/media/CWtsSQAUkAAnWws.jpg,1,malamute,0.606654,True,Border_collie,0.193831,True,collie,0.0483781,True,6498,0,36,2939,Dash,1.0
1497,678740035362037760,2015-12-21 00:53:29,Meet Tango. He's a large dog. Doesn't care much for personal space. Owner isn't very accepting. Tongue slip. 6/10 https://t.co/p2T5kGebxe,https://twitter.com/dog_rates/status/678740035362037760/photo/1,,https://pbs.twimg.com/media/CWtede2WIAAF_AJ.jpg,1,seat_belt,0.7871640000000001,False,sunglasses,0.045738699999999986,False,beagle,0.0225251,True,3407,0,34,1492,Tango,0.6
1499,678643457146150913,2015-12-20 18:29:43,Meet Grizz. He just arrived. Couldn't wait until Christmas. Worried bc he saw the swastikas on the carpet. 10/10 https://t.co/QBGwYrT7rv,https://twitter.com/dog_rates/status/678643457146150913/photo/1,,https://pbs.twimg.com/media/CWsGnyMVEAAM1Y1.jpg,1,Labrador_retriever,0.33875700000000003,True,flat-coated_retriever,0.30447,True,chest,0.0933923,False,1882,0,6,361,Grizz,1.0
1500,678446151570427904,2015-12-20 05:25:42,Touching scene here. Really stirs up the emotions. The bond between father &amp; son. So beautiful. 10/10 for both pups https://t.co/AJWJHov5gx,https://twitter.com/dog_rates/status/678446151570427904/photo/1,,https://pbs.twimg.com/media/CWpTLOYWsAEDhcU.jpg,1,Staffordshire_bullterrier,0.284492,True,Rottweiler,0.189434,True,American_Staffordshire_terrier,0.18943,True,3657,0,20,1374,nan,1.0
1501,678424312106393600,2015-12-20 03:58:55,This is Crystal. She's a shitty fireman. No sense of urgency. People could be dying Crystal. 2/10 just irresponsible https://t.co/rtMtjSl9pz,https://twitter.com/dog_rates/status/678424312106393600/photo/1,,https://pbs.twimg.com/media/CWo_T8gW4AAgJNo.jpg,1,Maltese_dog,0.759945,True,toy_poodle,0.101194,True,Shih-Tzu,0.0560374,True,5004,13,77,2285,Crystal,0.2
1502,678410210315247616,2015-12-20 03:02:53,Say hello to Jerome. He can shoot french fries out of his mouth at insane speeds. Deadly af. 10/10 https://t.co/dIy88HwrX8,https://twitter.com/dog_rates/status/678410210315247616/photo/1,,https://pbs.twimg.com/media/CWoyfMiWUAAmGdd.jpg,1,schipperke,0.145877,True,Labrador_retriever,0.0983538,True,kelpie,0.0973934,True,3834,0,30,1611,nan,1.0
1503,678399652199309312,2015-12-20 02:20:55,This made my day. 12/10 please enjoy https://t.co/VRTbo3aAcm,https://twitter.com/dog_rates/status/678399652199309312/video/1,,https://pbs.twimg.com/ext_tw_video_thumb/678399528077250560/pu/img/BOjUNHRsYLeSo0hl.jpg,1,swing,0.929196,False,Bedlington_terrier,0.0150472,True,Great_Pyrenees,0.014038900000000002,True,73607,1321,548,28639,nan,1.2
1504,678396796259975168,2015-12-20 02:09:34,These little fellas have opposite facial expressions. Both 12/10 https://t.co/LmThv0GWen,"https://twitter.com/dog_rates/status/678396796259975168/photo/1,https://twitter.com/dog_rates/status/678396796259975168/photo/1",,https://pbs.twimg.com/media/CWomSU_XIAAUYiK.jpg,2,Pembroke,0.95618,True,Cardigan,0.0318031,True,Chihuahua,0.0062765,True,1458,0,8,375,nan,1.2
1505,678389028614488064,2015-12-20 01:38:42,"This is Bella. She just learned that her final grade in chem was a 92.49 
poor pupper 11/10 https://t.co/auOoKuoveM",https://twitter.com/dog_rates/status/678389028614488064/photo/1,pupper,https://pbs.twimg.com/media/CWofOHUWUAACGVa.jpg,1,miniature_pinscher,0.516284,True,kelpie,0.227402,True,vizsla,0.103246,True,1712,0,14,383,Bella,1.1
1506,678380236862578688,2015-12-20 01:03:46,This is Crumpet. He underestimated the snow. Quickly retreating. 10/10 https://t.co/a0Zx5LDFZa,https://twitter.com/dog_rates/status/678380236862578688/photo/1,,https://pbs.twimg.com/media/CWoXOfSUAAA4u8g.jpg,1,dogsled,0.08854,False,snowmobile,0.057291,False,Samoyed,0.0476014,True,2246,0,15,822,Crumpet,1.0
1507,678341075375947776,2015-12-19 22:28:09,This pupper likes tape. 12/10 https://t.co/cSp6w5GWgm,https://twitter.com/dog_rates/status/678341075375947776/photo/1,pupper,https://pbs.twimg.com/media/CWnznDTU4AAa-6P.jpg,1,golden_retriever,0.853284,True,cocker_spaniel,0.0262298,True,Labrador_retriever,0.0241228,True,1575,0,18,474,nan,1.2
1508,678334497360859136,2015-12-19 22:02:01,This is Rosie. She has a snazzy bow tie and a fin for a tail. Probably super fast underwater. Cool socks 10/10 https://t.co/GO76MdGBs0,https://twitter.com/dog_rates/status/678334497360859136/photo/1,,https://pbs.twimg.com/media/CWntoDVWcAEl3NB.jpg,1,Norfolk_terrier,0.378643,True,golden_retriever,0.0955939,True,kelpie,0.0853092,True,1183,0,3,226,Rosie,1.0
1509,678278586130948096,2015-12-19 18:19:51,Another spooky pupper here. Most definitely floating. No legs. Probably knows some dark magic. 10/10 very spooked https://t.co/JK8MByRzgj,https://twitter.com/dog_rates/status/678278586130948096/photo/1,pupper,https://pbs.twimg.com/media/CWm6xySUEAAqfFU.jpg,1,Maltese_dog,0.897841,True,Lhasa,0.0357175,True,Tibetan_terrier,0.017107499999999998,True,10433,0,124,5499,nan,1.0
1510,678255464182861824,2015-12-19 16:47:58,This is Jessifer. She is a Bismoth Teriyaki. Flowers being attacked by hurricanes on bandana (rad). 9/10 stellar pup https://t.co/nZhmRwZzWv,https://twitter.com/dog_rates/status/678255464182861824/photo/1,,https://pbs.twimg.com/media/CWmlvxJU4AEAqaN.jpg,1,Chihuahua,0.613819,True,Yorkshire_terrier,0.127931,True,Pomeranian,0.062124300000000014,True,1453,0,20,327,Jessifer,0.9
1511,678021115718029313,2015-12-19 01:16:45,This is Reese. He likes holding hands. 12/10 https://t.co/cbLroGCbmh,https://twitter.com/dog_rates/status/678021115718029313/photo/1,,https://pbs.twimg.com/media/CWjQm5gXAAA9GkD.jpg,1,miniature_pinscher,0.822048,True,Doberman,0.0960845,True,Rottweiler,0.032709300000000004,True,12400,53,138,5650,Reese,1.2
1512,677918531514703872,2015-12-18 18:29:07,"""Everything looks pretty good in there. Make sure to brush your gums. Been flossing? How's school going?"" Both 10/10 https://t.co/lWL2IMJqLR",https://twitter.com/dog_rates/status/677918531514703872/photo/1,,https://pbs.twimg.com/media/CWhzTbzWUAAEAUN.jpg,1,Eskimo_dog,0.199347,True,dalmatian,0.153225,True,American_Staffordshire_terrier,0.107798,True,1220,0,13,364,nan,1.0
